[
  {"id":"offline-validation","argv":["python3","-B","-m","scripts.validate"],"tier":"offline","status":"passed","evidence":"results/validation.json","purpose":"Offline static, unit and lab checks","surface":"repository","version":"Python 3.12.3","risk":"low; no assistant/network at run","credentials":"none","output_type":"test exits","method":"lead local rerun after review fixes","result":"50 repository tests, 3 app tests, external baseline acceptance, generated references and static checks passed; results/validation.json records this final run"},
  {"id":"lab-check","argv":["python3","-B","labs/sample-app/scripts/check_lab.py"],"tier":"offline","status":"passed","evidence":"results/validation.json","purpose":"Standalone stdlib catalog self-check","surface":"sample app","version":"Python 3.12.3","risk":"low","credentials":"none","output_type":"exit status","method":"local","result":"Foundation passed"},
  {"id":"cli-help","argv":["copilot","--help"],"tier":"help-only","status":"observed","evidence":"results/help/capture.json","purpose":"Observe CLI flags","surface":"Copilot CLI","version":"1.0.89 isolated","risk":"help-only","credentials":"none, env -i","output_type":"hashed help text","method":"lead observation","result":"Exit 0; no authenticated use"},
  {"id":"headless-paid","argv":["python3","-m","scripts.headless","repo-summary"],"tier":"paid-integration","status":"not-run","evidence":null,"purpose":"Optional approved service integration","surface":"Copilot CLI","version":"not tested","risk":"paid model and local effects","credentials":"explicit reviewed HOME required","output_type":"private JSONL","method":"not performed","result":"No authenticated stdin/schema proof"},
  {"id":"plugin-lifecycle","argv":["copilot","plugin","install"],"tier":"paid-integration","status":"not-run","evidence":null,"purpose":"Potential future package lifecycle","surface":"plugin","version":"1.0.89 help","risk":"activation","credentials":"not provided","output_type":"none","method":"omitted due help/docs mismatch","result":"No installation or enablement"},
  {"id":"gitlab-read","argv":["python3","-B","-m","scripts.gitlab","--hostname","gitlab.example.com","--project","group/project","--pipeline","12345","--job","67890"],"tier":"offline","status":"passed","evidence":null,"purpose":"Explicit-host local GET dry-run plan","surface":"GitLab bridge","version":"current updated helper","risk":"none without --execute-read","credentials":"none","output_type":"read plan","method":"locally invoked dry-run","result":"Explicit-host GET argv plus human-only draft MR argv printed; no real GitLab request"},
  {"id":"lab-setup","argv":["python3","-B","-m","scripts.lab","setup","/tmp/my catalog lab","--state","/tmp/checkpoint-state","--exercise","validation"],"tier":"offline","status":"not-run","evidence":null,"purpose":"Create owned private defective fixture","surface":"local lab","version":"Python 3.12.3","risk":"writes new /tmp path, cleanup ID required","credentials":"none","output_type":"ownership JSON","method":"documented, tests use temporary copies","result":"Guide's exact path not created by writer"},
  {"id":"independent-oracle","argv":["python3","-I","-B","labs/expected-results/acceptance.py","/tmp/my catalog lab","validation"],"tier":"offline","status":"not-run","evidence":null,"purpose":"Human-reviewed code acceptance","surface":"local external oracle","version":"Python 3.12.3","risk":"child probes execute reviewed lab Python; not hostile sandbox","credentials":"none","output_type":"assertion exit","method":"documented, repository baseline run separately","result":"Copy path not created; no fabricated feature outcome"},
  {"id":"copilot-version","argv":["copilot","--version"],"tier":"help-only","status":"observed","evidence":"results/help/capture.json","purpose":"Record isolated CLI build","surface":"Copilot CLI","version":"1.0.89","risk":"help/version only","credentials":"none env -i","output_type":"version text","method":"lead capture","result":"Exit 0; not global authenticated installation"},
  {"id":"copilot-login","argv":["copilot","login"],"tier":"paid-integration","status":"not-run","evidence":null,"purpose":"Operator OAuth enrollment","surface":"Copilot CLI auth","version":"1.0.89 documentation","risk":"stores credentials/contacts GitHub","credentials":"operator-provided separately","output_type":"private auth state","method":"source-reviewed only","result":"Not authenticated by this repository"},
  {"id":"copilot-interactive","argv":["copilot","-C","/tmp/my catalog lab","--no-auto-update","--no-remote-export","--disable-builtin-mcps","--disallow-temp-dir","--available-tools=view,grep,glob"],"tier":"paid-integration","status":"not-run","evidence":null,"purpose":"First-15-minute read-only investigation, separate resume/edit approval","surface":"Copilot CLI interactive","version":"1.0.89 help","risk":"model credits, inherited policy, reviewed cwd under /tmp","credentials":"operator-provisioned entitlement","output_type":"private session and findings","method":"source/help-only walkthrough","result":"No actual CLI task run; temp flag does not establish sandbox"},
  {"id":"copilot-autopilot","argv":["copilot","-C","/tmp/my catalog lab","--autopilot","--max-autopilot-continues","3","--no-ask-user","-p","Inspect the reviewed catalog copy; report only, no edits or shell","--available-tools=view,grep,glob","--allow-tool=read","--no-remote-export","--disable-builtin-mcps","--no-auto-update","--disallow-temp-dir"],"tier":"paid-integration","status":"not-run","evidence":null,"purpose":"Candidate bounded prompt for separate isolation test","surface":"Copilot CLI headless","version":"1.0.89 help","risk":"paid; selective grant help/docs conflict; no guaranteed block","credentials":"operator-provisioned separately","output_type":"unverified answer","method":"candidate, not runtime validated","result":"Do not broaden on failure; temp flag not isolation"},
  {"id":"headless-dry","argv":["python3","-B","-m","scripts.headless","repo-summary","--repo","labs/sample-app","--prompt-file","examples/headless/repo-summary.txt"],"tier":"offline","status":"passed","evidence":null,"purpose":"Print bounded reviewed prompt transport","surface":"local Python wrapper","version":"Python 3.12.3","risk":"no assistant until explicit execute","credentials":"none","output_type":"dry-run JSON","method":"locally invoked dry-run","result":"Printed --disallow-temp-dir and typed unverified stdin transport; no model called"},
  {"id":"gitlab-execute-read","argv":["python3","-B","-m","scripts.gitlab","--hostname","gitlab.example.com","--project","group/project","--pipeline","12345","--job","67890","--execute-read","--home","REVIEWED_HOME","--output","NEW_FILE"],"tier":"paid-integration","status":"not-run","evidence":null,"purpose":"Explicit GET and sanitized trace","surface":"GitLab API bridge","version":"glab absent baseline","risk":"network read and private output","credentials":"designated reviewed GitLab HOME","output_type":"lossy sanitized JSON","method":"fake tests only","result":"No authenticated GitLab request"},
  {"id":"gitlab-human-push","argv":["git","push"],"tier":"paid-integration","status":"not-run","evidence":null,"purpose":"Human-authorized push to reviewed GitLab remote","surface":"Git host","version":"git 2.43.0","risk":"external branch write","credentials":"GitLab identity","output_type":"remote branch only after success","method":"instructions only","result":"Never invoked by docs writer"},
  {"id":"gitlab-mr-create","argv":["glab","mr","create","--repo","group/project","--source-branch","feature/catalog","--target-branch","main","--title","Catalog fix","--description","Reviewed changes","--draft"],"tier":"paid-integration","status":"not-run","evidence":null,"purpose":"Human-approved draft MR after push","surface":"GitLab MR","version":"glab absent baseline","risk":"remote write","credentials":"GitLab identity","output_type":"actual URL only if success","method":"official docs reviewed, not executed","result":"No MR created"},
  {"id":"hydra-preview","argv":["copilot","--experimental","--model","HYDRA_IF_AVAILABLE"],"tier":"paid-integration","status":"not-run","evidence":null,"purpose":"Optional model availability experiment","surface":"Copilot CLI model selection","version":"1.0.89 help","risk":"research preview, credits and optional installation update","credentials":"separate entitled operator","output_type":"no result","method":"announcement only; placeholder is not a literal model ID","result":"No preview eligibility or invocation observed"},
  {"id":"github-agent-task","argv":["gh","agent-task","list"],"tier":"paid-integration","status":"not-run","evidence":null,"purpose":"Future GitHub-only preview capability","surface":"GitHub gh CLI","version":"observed gh 2.45.0; supplied minimum >=2.80","risk":"GitHub API access","credentials":"GitHub project required","output_type":"remote task list","method":"manual source only","result":"No GitHub target host used"}
]
